"553228535511650305","08 Jan 2015 16:35:36","paris unesco staff solidarity charliehebdo freedom expression human right httptcohbtz7xm55e httptcom8steyu4s3","2"
"553228537084116993","08 Jan 2015 16:35:36","cartoons artists responding parisshooting httptcoazk7ggeuab charliehebdo freespeech please rt httptcoemlnyvbguk","2"
"553229177055219713","08 Jan 2015 16:38:08","shameful rt lifenews terrorist attack paris organized us intelligence httptcox5evkydl1u httptcojahddk82sa","2"
"553229592480481281","08 Jan 2015 16:39:48","charlie hebdo publish one million copies next week help google httptcoe1tkbbvpwl httptco1thluwbhvq","2"
"553229626756329472","08 Jan 2015 16:39:56","stupidity win survivors charliehebdo attack publish new issue next week httptconj2i6toy2j httptcogandakkrwe","2"
"553229808260632578","08 Jan 2015 16:40:39","one victim killed attack charlie hebdo muslim policeman ahmed merabet","2"
"553229948153262081","08 Jan 2015 16:41:12","must aware best weapon unity nothing must divide oppose separate us francois hollande jesuischarlie","2"
"553229956830875650","08 Jan 2015 16:41:14","muslim leaders worldwide condemned charlie hebdo attacks wont learn watching foxnews httptcoio6mrpxvb3","2"
"553230256992423936","08 Jan 2015 16:42:26","cartoonists around world responded charlie hebdo attack httptcoalxmvb4eu0 httptco9kxhtkfnzw","2"
"553230614712033283","08 Jan 2015 16:43:51","profits killing charlie opedge pepe escobar charliehebdo httptcop0lpnuyntg httptcoootud8r1uo","2"
"553230661012975618","08 Jan 2015 16:44:02","muslim must always straightforward consistent actions wordsrespectformuslimsjesuischarlie httptco9b1fkbydig","2"
"553231516290269184","08 Jan 2015 16:47:26","pictures charliehebdo solidarity vigils across globehttptcopwilxlqeud httptcodgr5c4tr6m","2"
"553231607449276416","08 Jan 2015 16:47:48","jesuischarlie hey folks enter free paypal sums httptcolilt8irzfy","2"
"553231667523883009","08 Jan 2015 16:48:02","funny killallchristians wasnt trending anders breivak murdered innocent soulsjesuischarlie httptcool8ozugnv1","2"
"553232137931849728","08 Jan 2015 16:49:54","charlie hebdo print million copies defiance attack httptco2kvfnsm5oi via business","2"
"553232531827740672","08 Jan 2015 16:51:28","morning france antimuslim terrorists threw grenades mosqueno injurieshttptco8wkhxso92b httptcoljipcir6hm","2"
"553232704708546561","08 Jan 2015 16:52:10","eiffel tower go dark pm local time paris remembrance charlie hebdo victims httptcocfejfkxnm8","2"
"553233130275221504","08 Jan 2015 16:53:51","believe terror works charlie hebdo print run next weeks issue increased usual copies one million","2"
"553233414145310720","08 Jan 2015 16:54:59","one hand saudi denounces attack charliehebdo condemns raifbadawi years lashes insulting islam","2"
"553233728030650368","08 Jan 2015 16:56:14","breaking news rip ahmed merabet muslim cop first victim charliehebdo attack httptco4w1vebusa0","0"
"553234456522522624","08 Jan 2015 16:59:07","dont know aftermath charlie hebdo shooting httptcodqxnuuydgw httptcoopg60ienzt","2"
"553234578086055937","08 Jan 2015 16:59:36","cartoonists dont deserve death artwork charliehebdo racist content doesnt become courageous ppl died","2"
"553235271169638400","08 Jan 2015 17:02:21","washington usa seattle httptcoxpvobdbrhv charliehebdo satirical newspaper charlie hebdo braved earlier attack threats befor","2"
"553235360722214912","08 Jan 2015 17:02:43","everytime satirist murdered satirists rise take place jesuischarlie","2"
"553236009081921536","08 Jan 2015 17:05:17","iran condemns charliehebdo massacre man death row blogging httptcoh1kbn2altw httptcowseuomptuf","2"
"553461741917863936","09 Jan 2015 08:02:16","rural region northern france searched hunt charliehebdo gunmen latest updates httptco7ivin3nqcv httptcoyrduiojrzf","3"
"553462249562832897","09 Jan 2015 08:04:17","eiffel tower went dark thursday evening honor victims charliehebdo attack httptcomtokogt8rl httptcormebitk2og","2"
"553463773844238337","09 Jan 2015 08:10:21","steve bell charlie hebdo attackers cartoon httptcookfs66mamx httptcojdclfgrzxd","2"
"553464709899616257","09 Jan 2015 08:14:04","httptcoppmyrfcu8h charlie hebdo magazine targeted paris shooting charliehebdo february httptco6zrashzl0q","2"
"553465105028222976","09 Jan 2015 08:15:38","fyi cop muslim rip ahmed merabet blame terror islam jesuischarlie charliehebdo httptcoamitvywgli","2"
"553466230989144064","09 Jan 2015 08:20:07","breaking hostages taken business dammartinengoele rtl reports france httptcoaa3fjvho8k","0"
"553466755411369985","09 Jan 2015 08:22:12","state surveillance emails prevent charliehebdo atrocity france already email surveillancelets anyway","2"
"553467311261503488","09 Jan 2015 08:24:24","reports shooting dammartin en goele route n2 north east paris french media says car chase way","3"
"553468492700454912","09 Jan 2015 08:29:06","breaking news exchange fire reported dammartinengoele httptco2a0s2wxbmz charliehebdo httptcofuysx2plaj","3"
"553468593141469184","09 Jan 2015 08:29:30","rt latuffcartoons lets talk seriously charliehebdo amp western double standard freedom speech httptcor7zbacbndm","2"
"553469263650906112","09 Jan 2015 08:32:10","terrorist muslim french envoys charliehebdo twitter photo goes viralhttptcoeq0zdmehea httptconws09tfi8k","2"
"553469523945590784","09 Jan 2015 08:33:12","reports shots fired northeast paris french police pursue two suspected charlie hebdo gunmen car chase httptcofbuyubjdoy","3"
"553469733656203264","09 Jan 2015 08:34:02","breaking hostages taken northeast paris police","0"
"553470140042735616","09 Jan 2015 08:35:39","breaking news shots fired hostages taken town northeast paris httptcocvtbtlqc6e","0"
"553470382129565696","09 Jan 2015 08:36:36","update ap french police chasing peugeot a2 motorway say hostages taken northeast paris charliehebdo","0"
"553470492565602305","09 Jan 2015 08:37:03","car chase way paris gunfight breaks reports hostages latest paris httptco2j4wqdjntp httptcolpd4hbixai","3"
"553470733180223489","09 Jan 2015 08:38:00","breaking shots fired northeast paris involving men believed charlie hebdo suspects httptcotyceemkwoo","3"
"553470907629707266","09 Jan 2015 08:38:42","bill maher hundreds millions muslims support attacks like httptcotb1ls1uqka charliehebdo httptco0zcduowpjl","2"
"553470977972375553","09 Jan 2015 08:38:58","breaking reports shots fired hostages taken town northeast paris httptcof30tsvt1yn httptcojeutp0iozg","0"
"553471193110421504","09 Jan 2015 08:39:50","hostages reportedly taken police pursue gunmen responsible parisattack httptcorkqmx9cijy httptcocilbwl4ewf","0"
"553471987411324929","09 Jan 2015 08:42:59","breaking gunfire hostages taken dammartinengole east paris police chase suspected charliehedbo attackers","3"
"553472225798795264","09 Jan 2015 08:43:56","breaking gunfire reported french town police hunt suspects charliehebdo attack soon httptcosiqeukzutl","3"
"553472437644320769","09 Jan 2015 08:44:46","breaking french police chasing peugeot motorway around paris say hostages taken cahrlie hedbo attack gunmen","3"
"553472488462901248","09 Jan 2015 08:44:58","police vehicles chase charliehebdo suspects french motorway httptcok3g8y2jde8 httptcombuxnx3krv","3"
"553472557978902529","09 Jan 2015 08:45:15","new york times square jesuischarlie httptcoqnexyby0bt","2"
"553473369539366912","09 Jan 2015 08:48:28","couple goarounds cdg unknown weather related connection charliehebdo shooting km airport httptcotsucrotwnk","2"
"553473416905629696","09 Jan 2015 08:48:40","convoy police cars rushing toward town northeast paris amid reports hostages taken france24 broadcast httptcozfjyh80uxy","0"
"553473550523580416","09 Jan 2015 08:49:12","breaking france hostages taken company northeast paris httpstco4yt6nafpig charliehebdo httptcodppbkd3ruk","0"
"553473559352606720","09 Jan 2015 08:49:14","boko haram killed people baga period days wont make news like charliehebdo africa lad","2"
"553473629854646272","09 Jan 2015 08:49:31","know guy feels really weird hearing media fountain european freedom speech charliehebdo httptco1iqtp6je9m","2"
"553473704060284928","09 Jan 2015 08:49:48","breaking news reports shots fired car chase northeast paris french police hunt charlie hebdo attackers httptcoyrb5bp0yv1","3"
"553474012446478336","09 Jan 2015 08:51:02","frances interior minister says operation detain charlie hebdo suspects underway northeast paris ap httptcozfjyh80uxy","1"
"553474188259102720","09 Jan 2015 08:51:44","breaking shots fired hostages taken manhunt charliehebdo attackers police say httptcoomby6wsgb7 httptcozbszahyizj","3"
"553474232596701184","09 Jan 2015 08:51:54","breaking reports hostage situation underway northeast paris httptcocoe8ybnp2m charliehebdo httptcogpbsthfkec","0"
"553474514496278528","09 Jan 2015 08:53:01","french interior minister says operation way detain charliehebdo suspects httptco2phnt9uofv","1"
"553474965278691330","09 Jan 2015 08:54:49","breaking french interior minister suspects paris terror attack believed holding least hostage near dammartinengoele","0"
"553475269873643520","09 Jan 2015 08:56:02","operation detain massacre suspects unfolding dammartinengoele miles northeast paris httptcoh1bhg5t7ec","1"
"553475430897156096","09 Jan 2015 08:56:40","details car chase norhteastern france hostages taken charliehebdo suspects httptcog6eunbdirj httptcoswdosifenp","3"
"553475729187680258","09 Jan 2015 08:57:51","breaking car chase way paris officers pursue charliehebdo suspects motorway httptcof30tsvt1yn httptco1shvasm5ym","3"
"553475824369012736","09 Jan 2015 08:58:14","two people reportedly seriously hurt shootout hunt parisattack gunmen httptcocvcfresdld httptco8emdi6ezl3","0"
"553476073703620609","09 Jan 2015 08:59:13","breaking french police convoy helicopters rush scene operation detain charliehebdo shooting suspects ap says","1"
"553476288103477249","09 Jan 2015 09:00:04","unreal toon charliehebdos cartoonists great demand via sagarcartoonist ajayendar httptcokkf0dgcnl4","2"
"553476471470432256","09 Jan 2015 09:00:48","reports french media hostage situation manhunt charliehebdo suspects centres dammartinengoele httptcopnhwzp39md","0"
"553476490315431937","09 Jan 2015 09:00:53","police convoy helicopters rushing scene detain charlie hebdo massacre suspects httptcoxdugohndhv httptcomsroyqs14o","1"
"553476600985948160","09 Jan 2015 09:01:19","update car chase hostage drama paris massacre suspects cornered httptcog958ogorxz","3"
"553476880339599360","09 Jan 2015 09:02:26","developing police pursuing charliehebdo shooting suspects helicopters deployed live feed httptcogrxhibeau2 httptcopdlmmcax1b","1"
"553477352542707712","09 Jan 2015 09:04:18","breaking police suspect gunmen taken one hostage shots fired involving charlie hebdo suspects httptcofykxchpd4d","0"
"553477554041257985","09 Jan 2015 09:05:06","report hostages taken printing shop northeast paris injuries france24 broadcast httptcohaschjovnc","0"
"553477692591726592","09 Jan 2015 09:05:39","breaking least one killed severeal injured shootout charliehebdo attack suspects local media httptcog6eunbdirj","0"
"553477943616634880","09 Jan 2015 09:06:39","update reuters reports least one person killed amp several injured shootout hostagetaking dammartinengoele france","0"
"553478014785187840","09 Jan 2015 09:06:56","say following atheist im sick amp tired double standard muslims face charliehebdo jesuischarlie httptcokpmtzthr9i","2"
"553478142791548928","09 Jan 2015 09:07:27","breaking news reports gunfire hostage search suspects paris attackhttptcou8be162qls","3"
"553478289474740224","09 Jan 2015 09:08:01","breaking dead several injured shootout northeast paris french radio rtlfrance httptcoldsf5qeciv charliehebdo","0"
"553478677359775744","09 Jan 2015 09:09:34","scene dammartinengoele police hunt charliehebdo suspects follow coverage httptcohvwonqgf9x httptconw8rb0e0ky","1"
"553479222434729984","09 Jan 2015 09:11:44","charlie hebdo suspects police said exchange fire northeast paris httptcopaeylkumvd","3"
"553479280014151681","09 Jan 2015 09:11:58","charlie hebdo ignored threat within societies says nigelfarage httptcobyprebop15 httptcomlsh5vdj5y","2"
"553479315711864832","09 Jan 2015 09:12:06","httptcoqmwa9qgrrg charlie hebdo attack hunt killers focuses northern france charliehebdo httptcoaksz683kby","1"
"553479401296625664","09 Jan 2015 09:12:27","charlie hebdo cartoonist wolinskis daughter dont think kill ideas httptco7nwogz3zs1","2"
"553480082996879360","09 Jan 2015 09:15:09","reports fatality injuries following shootout ahead dammartinengoele hunt live coverage httptcojm4ot03ge5 charliehebdo","0"
"553480257747963905","09 Jan 2015 09:15:51","charliehebdo attack outrages yet wont publish cartoons id defend pk ask mf husain questions httptco2s4nugbyq7","2"
"553480287045554176","09 Jan 2015 09:15:58","apple je suis charlie banner french site pointless host charlie hebdo kiosk free stop censorship","2"
"553480292498153472","09 Jan 2015 09:15:59","chaliehebdo terrorists held warehouse hostages jesuischarlie httptcoajysqfkmwa","0"
"553480333954678784","09 Jan 2015 09:16:09","case confusedcharliehebdo lucasofri via disinformatico httptcodme3g2flkj","2"
"553480702067736578","09 Jan 2015 09:17:37","shots fired hostages taken building east paris police hunt charliehebdo attackers httptcogfdui2rwln","0"
"553480876315901953","09 Jan 2015 09:18:18","estimated jews left france last year international media paid heed httptcoizkjxrsyjd","2"
"553480900869361664","09 Jan 2015 09:18:24","theres tension france muslim population httptcofvpfa8tqxf charliehebdo","2"
"553481076916883456","09 Jan 2015 09:19:06","breaking hostage taken charlie hebdo suspects sighted north paris httptconxwwifklmi","0"
"553481335948709888","09 Jan 2015 09:20:08","powerful newyorker front cover charliehebdo httptcokpsyaxloh2","2"
"553481963864993792","09 Jan 2015 09:22:38","draw cartoons jesuischarlie rt leandriii outrage 100s people boko haram wiped yesterday","2"
"553483415954411520","09 Jan 2015 09:28:24","know far major operation northeast paris charliehebdo httptcogwpwcdfija httptcoupekom4wcn","1"
"553483707122995201","09 Jan 2015 09:29:33","stop making attacks giving bad image islamcharliehebdo httptcos6gj7aaoyc","2"
"553483906096185345","09 Jan 2015 09:30:21","rt yairrosenberg um international business times running piece blaming charliehebdo attack israelhttptco2ndlxiupsp h","2"
"553484365012148225","09 Jan 2015 09:32:10","operation underway dammartinengoele area police hunt paris shooting suspects french interior minister tells cnn affiliate","1"
"553484530804613120","09 Jan 2015 09:32:50","arsene wenger think country like france die ideas absolutely shocking jesuischarlie","2"
"553484619426062336","09 Jan 2015 09:33:11","ago tweeted charliehebdo cover mocking british dont remember anyone threatening violence httptco28z2jmtv5i","2"
"553484760233017344","09 Jan 2015 09:33:44","area northeast paris shots fired manhunt charlie hebdo attackers httptco0w4gaarwcf httptco4ejwr9smm4","3"
"553484780093050880","09 Jan 2015 09:33:49","gendarmerie arrive hostage taking dammartinengoele latest httptco7n7uvclhwy picmartmannreuters httptcokntlzzmvhm","1"
"553485452943302656","09 Jan 2015 09:36:29","breaking french police suspects newspaper attack appear taken hostage northeast paris","0"
"553485654030446592","09 Jan 2015 09:37:17","jesuischarlie sheep make sick condemn killings dont make heroes martyrs racist idiots","2"
"553485866346483713","09 Jan 2015 09:38:08","hrs amp paris makes charliehebdo honorary citizen mths amp craven elites wont even name lee rigby memoral fear offence","2"
"553486439129038848","09 Jan 2015 09:40:25","breaking french police tell ap suspects charliehebdo attack taken hostage northeast paris","0"
"553486529231089664","09 Jan 2015 09:40:46","breaking paris massacre suspects holding one hostage police source","0"
"553486601146617856","09 Jan 2015 09:41:03","case confused check whos terrorist whos muslim jesuischarlie jesuisahmed httptcowsq17z1tqb","2"
"553486796534054912","09 Jan 2015 09:41:50","meaux hospital sent medical team reported hostage scene northeast paris hospital communications director says httptcovnctopmhmx","0"
"553487356733313024","09 Jan 2015 09:44:03","paris peshawar answer humanrights httptcomxghotro2l charliehebdo","2"
"553487544508493825","09 Jan 2015 09:44:48","charliehebdo attack suspects take person hostage northeast paris police source httptcoldsf5qeciv httptco2y5fpwhxa7","0"
"553487579077550082","09 Jan 2015 09:44:56","hundreds massacres committed daily muslims burma nobody says wordcharliehebdojesuischarlie httptcor2qkysjvdw","2"
"553487625815064576","09 Jan 2015 09:45:07","stop todays flogging raifbadawi ukinsaudiarabia cant condemn charlie hebdo attack yet flogimprison freethinkers freeraif","2"
"553487971497041920","09 Jan 2015 09:46:30","schools close people told stay indoors amid dammartinengoele charliehebdo manhunt httptcod8ztxccak5 httptcojuvyyleaj4","1"
"553488054640340992","09 Jan 2015 09:46:50","latest manhunt charlie hebdo attackers httptcojfmqw07vhk httptcomjiipm2ghg","3"
"553488824656203776","09 Jan 2015 09:49:53","schools closed dammartinengoele residents told stay indoors town like warzone httptcog6eunbdirj httptcofatmw7d3xk","1"
"553488850363101184","09 Jan 2015 09:49:59","analysis story police officer killed charliehebdo attack longer headlines httptcokpqmgkbjhg","2"
"553489393202499584","09 Jan 2015 09:52:09","paris murder suspects cornered hostagehttptcoyzhji4hw54","0"
"553489837542899712","09 Jan 2015 09:53:55","west fought foreign wars ignored threat within societies says nigelfarage httptcocj8lyeld5u","2"
"553489907524829184","09 Jan 2015 09:54:11","httptcogirzjm1zs7 charlie hebdo long tradition disrespect provocation charliehebdo httptcoyyy4nxbgaz","2"
"553490160344502273","09 Jan 2015 09:55:12","algerian muslim editor killed charliehebdo attack nobody knows moustapha ourrad jesuismuslim httptconizghaxpsl","2"
"553490238979727360","09 Jan 2015 09:55:30","massacre suspects believed taken hostage holed small industrial town northeast paris httptcolmr2imjhmr","0"
"553490241445965824","09 Jan 2015 09:55:31","awful attack charliehebdo france set example tolerance protect muslims reprisals httptcoav3l4slt7h","2"
"553490358748061696","09 Jan 2015 09:55:59","french police asking media broadcast live images scene paris hostage situation police locations revealed bnonews","2"
"553491005971132416","09 Jan 2015 09:58:33","police officers involved search charliehebdo suspects cherif said kouachi httptcoqb4b5ckvpg","2"
"553491517462315008","09 Jan 2015 10:00:35","attacks london bombings madrid boston marathon fort hood paris oklahoma beheading supposed question islam","2"
"553491540535156736","09 Jan 2015 10:00:41","charliehebdo latest gunmen believed holed building reports hostage shots fired car chase httptcoxl5uwqhqta","0"
"553491604917334016","09 Jan 2015 10:00:56","prophet pbuh never killed anyone blasphemy justification islam charliehebdo murders trend muslimsforpeace","2"
"553491924015783936","09 Jan 2015 10:02:12","journalists beijing gather jesuischarlie photo police pleased httptcojzgjhtad88 afp httptcorkbmlsdygm","2"
"553492305521672192","09 Jan 2015 10:03:43","irony hurts apple repeatedly censored charliehebdo platforms claiming charlie httptcob1duzbndzq","2"
"553492417023057920","09 Jan 2015 10:04:10","charliehebdo journalists inside dammartin asked avoid filming police positions alert suspects","2"
"553493222052605952","09 Jan 2015 10:07:22","developing charliehebdo shooting suspects holed premises construction company httptcog6eunbdirj httptcojw357f31go","1"
"553493300242432000","09 Jan 2015 10:07:40","charliehebdo jazeera double standard freedom expressionhttptcogvjlx2npad","2"
"553493510306152448","09 Jan 2015 10:08:30","industrial zone dammartinengol near paris scene hostage taking manhunt httptco8zhiazashc httptcozcpxy3en1p","0"
"553493707472011264","09 Jan 2015 10:09:17","special forces stands roof building dammartinengoele hostagetaking underway afp httptcogcm7trrvfd","0"
"553493785523400704","09 Jan 2015 10:09:36","building dammartinengoele charliehebdo suspects believed holed httptcobxiqyiqt0r httptcohszl3gk9et","1"
"553495137314435072","09 Jan 2015 10:14:58","charlie hebdo killers say want die like martyrs suspect french police happy oblige","3"
"553495922639122432","09 Jan 2015 10:18:06","update french police standoff charliehebdo attack suspects hostage believed taken httptcojzqo5su0a1 httptcozexugwcdzd","0"
"553496228055777280","09 Jan 2015 10:19:18","breathtaking cover next weeks new yorker ana juan jesuischarlie httptcopqzgcnxxym","2"
"553496489641902080","09 Jan 2015 10:20:21","neither islam multiculturalism blame bloody charliehebdo attack un human rights chief zeid httptcoh3x28yosxd","2"
"553496697918468096","09 Jan 2015 10:21:10","case confusedcharliehebdo httptcofeqv6zruts","2"
"553497508970631168","09 Jan 2015 10:24:24","picture worth thousand words jesuischarlie jesuisahmedjesuishumaincharliehebdovia raseef22 httptcoekycmauf33","2"
"553497730476015617","09 Jan 2015 10:25:17","poor attempt bdutt justify charliehebdo attack despite fact france first recognise palestine httptcoe4bblswwop","2"
"553497835371757568","09 Jan 2015 10:25:42","historic moment eiffeltower goes dark unify world around charliehebdo jesuischarlie parisshooting httptcoc5iwqgw6aa","2"
"553498106588049408","09 Jan 2015 10:26:46","wow newyorker cover charliehebdo httptco7lxsttoykw","2"
"553499806883381249","09 Jan 2015 10:33:32","live feed scene standoff charliehebdo shooting suspects amp police httptcoq4kqyo2shc httptcogcsvg5iaqh","2"
"553500238246608896","09 Jan 2015 10:35:14","gallery tank amp armoured car seen near charliehebdo seige outside paris heathcliffom httptcokalte4fmsd httptco9lyeszgpal","1"
"553500932521336832","09 Jan 2015 10:38:00","residents dammartinengoele told stay inside schools lockdown mayors press office tells cnn httptco7bxdhozq4h","2"
"553501357156876290","09 Jan 2015 10:39:41","charliehebdo suspects prepared die martyrs tell police making contact french media httptcoqgmn70txsu","3"
"553501469388058626","09 Jan 2015 10:40:08","tribute victims amp statement world jesuischarlie httptcotjlbogptt4","2"
"553501773517033472","09 Jan 2015 10:41:21","theres tank near paris hostage scene httptco7n7uvclhwy pic heathcliff omalley httptcoepxhd9k6gf","1"
"553502180666531840","09 Jan 2015 10:42:58","person living near dammartin hostage scene sent us photos charliehebdo obs httptcofkhd1fgt03","0"
"553502311872733184","09 Jan 2015 10:43:29","field near printers become makeshift helicopter pad airforce gendarmerie puma helicopters charliehebdo httptcoo5vqofpwlv","1"
"553502446769942528","09 Jan 2015 10:44:01","charlie hebdo killers tell police ready die martyrs httptcoh4gp9baetn httptcommf4hxukdd","3"
"553502749498036224","09 Jan 2015 10:45:13","yo charlie hebdo im really sad ima let finish la best galette time reporte au janvier balkanye west","2"
"553503184174710784","09 Jan 2015 10:46:57","charliehebdo shooting suspects tell police prepared die martyrs french media httptcog6eunbdirj httptcojonfaapehf","3"
"553503546382249984","09 Jan 2015 10:48:23","breaking charliehebdo suspects almost certainly behind hostage taking say officials httptcoqb4b5ckvpg httptcoigjnu386dq","0"
"553503846258196480","09 Jan 2015 10:49:35","muslims dont believe freedom speech radical cleric chaudry httptcoor8typgcih charliehebdo httptcow2haakojjq","2"
"553503909692841984","09 Jan 2015 10:49:50","hundreds police siege dammartinengoele follow charliehebdo coverage httptcojmozxpasoj httptcokpalm9tqwq","1"
"553503995872808961","09 Jan 2015 10:50:10","rt dabeard wow newyorker cover charliehebdo httptcoxkcqbcehpz","2"
"553505242554175489","09 Jan 2015 10:55:08","suspects charliehebdo attack spoke police phone said wanted die martyrs says french mp httptcobgkmtt3luf","3"
"553505371290357761","09 Jan 2015 10:55:38","charlie hebdo attack suspects told police phone wanted die martyrs french lawmaker tells tv station httptco7bxdhozq4h","3"
"553505458162782208","09 Jan 2015 10:55:59","know suspects charlie hebdo attacks httptcolgoa0zripz httptcozahs26igzy","2"
"553505858811080704","09 Jan 2015 10:57:35","afp map region northeast paris wednesdays massacre suspects cornered hostage httptcoh9swsdtfrf","0"
"553506091389440000","09 Jan 2015 10:58:30","httptcodvgufqueq4 charlie hebdo charlie hebdo attack helicopters hunt suspects woods france httptco8whrb18em7","2"
"553506337121107968","09 Jan 2015 10:59:29","weds saudi arabia condemned charliehebdo cowardly attack today flogged raif badawi encouraging free speech","2"
"553506608203169792","09 Jan 2015 11:00:33","map shows industrial estate charliehebdo suspects holed surrounded police httptcohi9g8dxpir httptcovw2l6sqcmh","1"
"553506946054369280","09 Jan 2015 11:01:54","think ticks boxesjesuischarlie httptcottbo4qhjp9","2"
"553506985413713920","09 Jan 2015 11:02:03","charlie hebdo print million copies next edition government google help httptco7nwsbpcbew httptcovu5xunjxj6","2"
"553508098825261056","09 Jan 2015 11:06:29","police surrounded building suspected charliehebdo attackers holedup httptcob0trve2iys httptcobecxng0kxi","1"
"553508524320653312","09 Jan 2015 11:08:10","two days ago saudi arabia denounced charliehebdo attack today flogged raifbadawi expressing opinions httptcookxme6xild","2"
"553509146730176513","09 Jan 2015 11:10:38","charlie hebdo dont blame bloodshed frances muslims nabila ramdani httptcoxzlutysyzn","2"
"553509181446443008","09 Jan 2015 11:10:47","horrified charliehebdo lets forget raifbadawi lashes today jeddah first batch httptcol8acrzuhvz","2"
"553509591888441344","09 Jan 2015 11:12:25","solution jesuischarlie charliehebdo httptcox8qzae32wk","2"
