"552830599002857472","07 Jan 2015 14:14:20","jesuischarlie charliehebd chaliehebdo one child one teacher one book one pencan change world malala httptcoi2mpqdna7g","2"
"552830668607348736","07 Jan 2015 14:14:37","brilliant charliehebdo satirists attack islam poked fun intolerance amp extremism kind inc racism amp islamophobia","2"
"552830674357334016","07 Jan 2015 14:14:38","rt froomkin charliehebdos charb would rather die standing live knees httptcocglb7c9tz2 httptcorjjzm3r6gb","2"
"552830684021424128","07 Jan 2015 14:14:40","update police say gunmen loose people killed hq satirical publication charliehebdo attacked paris","0"
"552830781656428544","07 Jan 2015 14:15:04","salman rushdie stand charliehebdo must defend art satire always force liberty","2"
"552830850279424001","07 Jan 2015 14:15:20","among killed charliehebdo shooting editorinchief graphic artist least one police officer httptcowxpliyaxdq","2"
"552830862585503746","07 Jan 2015 14:15:23","new yorker cartoon seems particularly relevant charliehebdo attack httptco9hbdyh2imz","2"
"552830864187727876","07 Jan 2015 14:15:23","three gunmen shot dead people hq charliehebdo still run paris police say httpstco3qkwhn0kgy","0"
"552830966411321344","07 Jan 2015 14:15:48","rushdie religion mediaeval form unreason combined modern weaponry becomes real threat freedoms charliehebdo","2"
"552831101312303104","07 Jan 2015 14:16:20","people reportedly killed shooting french satirical magazine charlie hebdo httptcoj5qld3v5is httptcoexex2sm7k5","2"
"552831107985858560","07 Jan 2015 14:16:21","rushdie religions like ideas deserve criticism satire yes fearless disrespect charliehebdo","2"
"552831197420994560","07 Jan 2015 14:16:43","free speech need defending magazine editors gunned satirical cartoons yes needs defending httpstcomvr6jsghzf","2"
"552831230735962113","07 Jan 2015 14:16:51","cartoon newyorker well worth remembering today charliehebdo parisshooting httptco6gonswwrfc","2"
"552831266945794048","07 Jan 2015 14:16:59","paris charliehebdo attack worst act terrorism france years httptcoxyarpx72q7 httptcohrxlhw9h4v","2"
"552831420197261314","07 Jan 2015 14:17:36","paris charliehebdo attack worst act terrorism france years httptco6cut73pm7o httptcomhk5rubmta","2"
"552831460236099586","07 Jan 2015 14:17:45","strongly condemn horrific shooting offices charliehebdo us president obama says httptcoz0kp0zjmgs","2"
"552831506041683970","07 Jan 2015 14:17:56","day free speech died little newyorker cartoonists poignant response charliehebdo attack httptco11lrj4a0yz","2"
"552831515940634624","07 Jan 2015 14:17:59","died charliehebdo live forever pens powerful guns dont ever let terror make think otherwise","2"
"552831524002103297","07 Jan 2015 14:18:01","please rt petition calling solidarity w charliehebdo httpstco1yiifudpw4 maryamnamazie nickyaacampbell ffrf openlysecular","2"
"552831624283693056","07 Jan 2015 14:18:25","charliehebdos charb would rather die standing live knees httptcoryrhlavy7t httptcocxshfjvlrn ht froomkin","2"
"552831705351225344","07 Jan 2015 14:18:44","jesuischarlie trends brutal shooting charliehebdo magazine httptco2tt7bnox1u httptcoomtseqxs1h","2"
"552831761957523456","07 Jan 2015 14:18:57","heres newyorker cartoonists response charliehebdo attack httpstcofeyrmwycui","2"
"552831842232324097","07 Jan 2015 14:19:16","cartoon solidarity httptcoyarwaoslcw charliehebdo httptcotgi2au6hp3","2"
"552831881847533568","07 Jan 2015 14:19:26","three attackers hunted assault french magazine charliehebdo french interior minister says httptcof7zb9jxife","0"
"552831974784905216","07 Jan 2015 14:19:48","salman rushdie respect religion become code phrase meaning fear religion charliehebdo","2"
"552831978522021890","07 Jan 2015 14:19:49","may agree say defend right say voltaire jesuischarlie libertdexpression httptcorsbyppgyfq","2"
"552832019940376576","07 Jan 2015 14:19:59","bob mankoff new yorker cartoon editor jesuischarlie httptcodk40qynqvu","2"
"552832142397296641","07 Jan 2015 14:20:28","incredible see universal outrage europe charliehebdo double standards comes palestinian attacks israel","2"
"552832169496694786","07 Jan 2015 14:20:34","quran actually commands muslims prophet ridiculedcharliehebdo parisshooting httptco562fufpf76","2"
"552832177138696192","07 Jan 2015 14:20:36","omg least one msm publication done unthinkable navbharat times posted charliehebdo cartoons httptcouz4drqqdno","2"
"552832232197746688","07 Jan 2015 14:20:49","charliehebdo shooting act terror violence political motive well within existing threat assessment","2"
"552832291601674240","07 Jan 2015 14:21:04","65k twitter users show solidarity french satirical magazine charliehebdo httptcorgy00sexur httptcogdrmubb9c6","2"
"552832584045330432","07 Jan 2015 14:22:13","pictures scene gunmen attack paris charliehebdo office httptcolcnsyqkc3y httptcojwbnd2mkus","2"
"552832721945628672","07 Jan 2015 14:22:46","thoughts prayers victims terrorist attack people france pres obama statement charliehebdo","2"
"552832738542514176","07 Jan 2015 14:22:50","freedom attacked stand stand together stand strong ignorance evil stupidity extremism enough charliehebdo","2"
"552832784046108672","07 Jan 2015 14:23:01","hindus tolerant would fate hirani amp aamir charliehebdoparisshooting httptcotif56s3pho","2"
"552832817089236992","07 Jan 2015 14:23:09","stills eyewitness video show two charliehebdo attackers wearing hoods amp black clothing shoot wounded man httptcoix8wys3p5m","1"
"552832996676730881","07 Jan 2015 14:23:52","muslim killing innocent people name islam much much offensive cartoon ever charliehebdo","2"
"552833028201144320","07 Jan 2015 14:23:59","urgent gunmen involved deadly attack charliehebdo french interior minister httptco3jsosc7yl3 paris httptco9fqt2p6yhv","0"
"552833148128862208","07 Jan 2015 14:24:28","dr ali irish islamic culture centre said would seek legal advice journalist tweets one charliehebdo cartoons","2"
"552833197084778496","07 Jan 2015 14:24:39","social media users show solidarity charliehebdo jesuischarlie hashtag httptcov0m1bupomy httptcomci5nwdldq","2"
"552833236389199874","07 Jan 2015 14:24:49","every religion mocked judaism christianity buddhits muslims islamists resort brutal terror charliehebdo","2"
"552833268362772481","07 Jan 2015 14:24:56","papers covering charliehebdo story without publishing cartoons arent curbing terrorism victims","2"
"552833393734721537","07 Jan 2015 14:25:26","picture sums islam charliehebdo httptcohx7uzbiexm","2"
"552833432540430337","07 Jan 2015 14:25:36","charliehebdo magazine targeted attack httptco3s9g3kumkj parisshooting httptcosixk6vrtmi","2"
"552833483325059072","07 Jan 2015 14:25:48","faith withstand humor even vicious humor pathetic faith satire help religion see flaws charliehebdo","2"
"552833527444566016","07 Jan 2015 14:25:58","satire mohammed get killed satire hindu god get crs still hindus learn tolerancecharliehebdo","2"
"552833658017824768","07 Jan 2015 14:26:29","president obama sold charlie hebdo httptcomtkyyiyqdw","2"
"552833662593400833","07 Jan 2015 14:26:30","paris terrorist attack kills cartoonists including chief editor sources httptcos5ruzhl4m3 charliehebdo httptcof5yd2w8h8i","2"
"552833681111658496","07 Jan 2015 14:26:35","muslims embrace free speech even includes insults prophet httptcos12eyry2qs charliehebdo","2"
"552833795142209536","07 Jan 2015 14:27:02","east london mosque would like offer sincere condolences families killed charliehebdo attacks","2"
"552833941930274816","07 Jan 2015 14:27:37","justification whatsoever taking life charliehebdo","2"
"552833942777511937","07 Jan 2015 14:27:37","take offence disapprove demonstrate silence kill intimidated jesuischarlie httptcouil7iv8zaf","2"
"552834033600966657","07 Jan 2015 14:27:59","horrific attack france free speech france cradle press freedom deep condolences solidarity charliehebdo","2"
"552834182905221121","07 Jan 2015 14:28:35","president obamas statement charliehebdo shooting makes mention freedom speech press","2"
"552834229722038273","07 Jan 2015 14:28:46","strongly condemn horrific shooting offices charlie hebdo magazine paris president obama httptcoqr9zegu04o","2"
"552834411553886209","07 Jan 2015 14:29:29","white house responds shooting paris offices charliehebdo httptcocd0y6naove httptcok7rp2sqkey","2"
"552834445301256192","07 Jan 2015 14:29:37","breaking three gunmen involved attack charlie hebdo magazine french interior minister bernard cazeneuve says httptcoak9mtvfjdr","0"
"552834461478715392","07 Jan 2015 14:29:41","people carried charliehebdo attack authorities searching french interior minister says httptcozufxcg3rfs","0"
"552834481183539201","07 Jan 2015 14:29:46","days charlie hebdos firebombing ran image cartoonist kissing jihadi caption love stronger hate","2"
"552834501383290880","07 Jan 2015 14:29:50","mayor paris anne hidalgo calls march thursday pariss republic square charliehebdo attack httptcohnwevcldry","2"
"552834558706847745","07 Jan 2015 14:30:04","four frances revered cartoonists among killed charliehebdo massacre httptcog16d4xmwhk httptcocf7fhudxfb","2"
"552834559297867778","07 Jan 2015 14:30:04","little weapon charliehebdo cartoon httptcovffzd2f8rz","2"
"552834623944671232","07 Jan 2015 14:30:20","paris charliehebdo attack worst act terrorism france years httptcojo1hyb4vjj httptcogprxnlmx7a","2"
"552834640692912128","07 Jan 2015 14:30:24","sunni extremists behind charliehebdo attack issues mocking shia holy figures cartoons agmahdi httptco9l9jepj8nb","2"
"552834732325879809","07 Jan 2015 14:30:46","white house presssec says shooting charliehebdo office seems attack freedom press parisshooting httptcozulrpkriuv","2"
"552834754056556544","07 Jan 2015 14:30:51","may agree say defend right say voltaire shocked jesuischarlie httptcodta3cdpuhu","2"
"552834808121163776","07 Jan 2015 14:31:04","standing freedom speech tweeting charliehebdo cartoon httptcoiyeyrxeadk homage french martyrs","2"
"552834842837409793","07 Jan 2015 14:31:12","muslim condemn cruel attack charliehebdo amp offer condolences french peoplethe islam murderers mine","2"
"552834961762709505","07 Jan 2015 14:31:40","paris manhunt charliehebdo attackers ak rifles amp reportedly rocketpropelled grenade still large httptco3jsosc7yl3","1"
"552834996265054208","07 Jan 2015 14:31:48","ukips culture spokesman prwhittle freedom bedrock western democracy nonnegotiable charliehebdo","2"
"552835109372825601","07 Jan 2015 14:32:15","new yorkers reaction charliehebdo shooting httptcofwtnxbbnyq","2"
"552835209285337089","07 Jan 2015 14:32:39","salman rushdie satire always force liberty tyranny dishonesty stupidity charliehebdo","2"
"552835221859483649","07 Jan 2015 14:32:42","thoughts wour allies france whitehouse spokesman says httptcooibztyu4kl charliehebdohttpstcoss7gdsd1tq","2"
"552835288725061635","07 Jan 2015 14:32:58","cartoon worth words robert mankoff newyorker sept charliehebdo bobmankoff httptcohcy9m1a9qh","2"
"552835301547442176","07 Jan 2015 14:33:01","freedom expression seems taken granted rip died defending jesuischarlie httptcomexshkelgv","2"
"552835339325558785","07 Jan 2015 14:33:10","jesuischarlie trending worldwide tweets via trendsmap via bbctrending httptcok5arxmmyr9 httptcozfq8krne7u","2"
"552835385043062784","07 Jan 2015 14:33:21","globally cartoonists like nadessinateur paying homage peers killed charliehebdo attack httptcotuyqizp2gi","2"
"552835794646212608","07 Jan 2015 14:34:59","satire mohammed get killed satire hindu god get crs still hindus learn tolerancecharliehebdo","2"
"552835854750605313","07 Jan 2015 14:35:13","able satirise religion religion able cope httptcomgu7p5oms7 pic f strazzari httptcouhvarphm38","2"
"552835988540895232","07 Jan 2015 14:35:45","nows good time read christopher hitchens case mocking religion httptcox9gpr2y9y1 charliehebdo standwithcharliehebdo","2"
"552836095332081664","07 Jan 2015 14:36:10","charlie hebdoseriously god ampor prophet needs armed men protect cartoons pretty much says hes huge pussy","2"
"552836100814032896","07 Jan 2015 14:36:12","stop charliehebdo httptcolprncpnb5e","2"
"552836167029514240","07 Jan 2015 14:36:28","mt kreasechan sort free expression authoritarians tolerate syrian artist ali farzat jesuischarlie httptcopsfnduluw6","2"
"552836204283326465","07 Jan 2015 14:36:36","charliehebdo last cover satirizing isis mohammed returnedbut im prophet blockhead shut infidel httptcoausifclxrf","2"
"552836392678465537","07 Jan 2015 14:37:21","proud ndtv upholding indias secular credentials nidhi razdan notorious french magazine attacked armed men charliehebdo","2"
"552836444835037184","07 Jan 2015 14:37:34","web strongly condemn terrorist attack charlie hebdohttptcocb3mszwiae httptcozazaxvokv9","2"
"552836516775354368","07 Jan 2015 14:37:51","indian media standing charliehebdo amp freedom speech lets ask publish said cartoon right parisshooting","2"
"552836586191474689","07 Jan 2015 14:38:08","calls every newspaper europe print charlie hebdo cartoons httptco2tt7bnox1u httptcoomtseqxs1h jesuischarlie","2"
"552836695754678273","07 Jan 2015 14:38:34","americans rest assured couldve prevented todays paris terrorist attack waterboarding wouldnt mean","2"
"552836775191019520","07 Jan 2015 14:38:53","man urinates mosque prophet asks let finish wash away sits calmly explains charliehebdo","2"
"552836829234614272","07 Jan 2015 14:39:05","twitter users expressing solidarity charliehebdo using hashtag jesuischarlie httptcontuiihjvl6 httptcoknvlki7hne","2"
"552836844560609281","07 Jan 2015 14:39:09","counter terrorism expert colonel mike dewar says paris put virtual shutdown charliehebdo httptcoqdoohi456v","2"
"552836854085459968","07 Jan 2015 14:39:11","way global media pay respect charliehebdo martyrs reprinting republishing amp amp amp","2"
"552836898562265088","07 Jan 2015 14:39:22","france dark day freedom expression gunmen attack newspaper office charliehebdo httptcoqqpl3r4rof httptcorusltisgjo","2"
"552836913091330051","07 Jan 2015 14:39:25","charlie hebdo editor stphane charbonnier killed today dead alive list aqap inspire march httptcomptfsbywez","2"
"552836968410021888","07 Jan 2015 14:39:39","prophet insulted amp hit stones till body covered blood yet forgave prayed charliehebdo","2"
"552836975741632514","07 Jan 2015 14:39:40","murderers hijacked religion farright hijack murders cycle hate charliehebdo","2"
"552836985493409792","07 Jan 2015 14:39:43","man compares prophet dog prays forgiveness buried cloak prays upon funeral charliehebdo","2"
"552837012689264640","07 Jan 2015 14:39:49","charliehebdo editorinchief people attack newspaper newspaper weapon war httptcok7zhv9c27f","2"
"552837016350912512","07 Jan 2015 14:39:50","brilliant bob mankoff new yorker cartoon editor charliehebdo httptcohlgxq0uf7e","2"
"552837027616804864","07 Jan 2015 14:39:53","really important spread news muslims condemning mass murder charliehebdo httptco9gzwacxgq1","2"
"552837035732381696","07 Jan 2015 14:39:55","terrorist people like sudheenkulkarni blot societyparisshooting charliehebdo httptco8eb7ewyi9w","2"
"552837078854410241","07 Jan 2015 14:40:05","photos scene deadly attack gunmen paris offices newspaper charlie hebdo httptcoe1zzo50lxx httptcozzzdodhcsi","2"
"552837086425128961","07 Jan 2015 14:40:07","france update car fire synagogue paris accident related wcharliehebdo sarcelles mayor httptcozk3ey3xhxy","2"
"552837132491186179","07 Jan 2015 14:40:18","frances top security official confirms gunmen carried attack charliehebdo httptcogl0vcc2ip5","0"
"552837147305455616","07 Jan 2015 14:40:21","imagine thousands muslims living france whose lives never today charliehebdo","2"
"552837168482492416","07 Jan 2015 14:40:26","charliehebdo shooting video uncensored full version httptcotri2n3fpra franceattack parisshooting httptcoynbhkori5n","2"
"552837190360006657","07 Jan 2015 14:40:32","charliehebdos charb massacred today kurds defend us rest peace brother twitterkurds httptcoedizbjevja","2"
"552837268160135169","07 Jan 2015 14:40:50","newyorker cartoonists response charliehebdo attack httpstco0gseord87r","2"
"552837310707171328","07 Jan 2015 14:41:00","charlie hebdo time uphold freedoms give fear says simonjenkins4 httptcoxwidzj5poa","2"
"552837484221300736","07 Jan 2015 14:41:42","man violently lifts prophet lapels cloak asking money smiles gives hes due charliehebdo","2"
"552837499937378305","07 Jan 2015 14:41:45","charlie hebdos right draw muhammad httptcoglf9dgwfs0 httptcoyrxtwsnu5q","2"
"552837527640363010","07 Jan 2015 14:41:52","religion peace back work muslims attack french magazine mocked muhammad killing charliehebdo parisshooting","2"
"552837561119686656","07 Jan 2015 14:42:00","wants english europe quite enjoying charliehebdo covers httpstcop0qs7l0q1h httptcogmzjnnhwc3","2"
"552837599304622080","07 Jan 2015 14:42:09","prophet saidwhoever curses prophet kill whoever curses companions beat himattabarani addaraqutnicharliehebdo","2"
"552837610897694720","07 Jan 2015 14:42:12","see cartoon shawtooner rounds rightly jesuischarlie httptcobgfdkodiyf","2"
"552837644959621120","07 Jan 2015 14:42:20","jesuischarlie charb assassinated today kurds defend us rest peace brother twitterkurds httptcol5yvscoedk","2"
"552837655105658880","07 Jan 2015 14:42:22","statement appalling attack charliehebdo httptcoic5tsvho0f","2"
"552837775498964992","07 Jan 2015 14:42:51","hope one day one insult prophet terrorist threats universally respected charliehebdo","2"
"552837814946394112","07 Jan 2015 14:43:00","jesuischarlie internet unites charliehebdo terrorists httptco09yijpkvu2 httptcolz2xkzisq3","2"
"552837907174948864","07 Jan 2015 14:43:22","condemning islamic ideology killed charliehebdo sympathy doesnt mean shitsupport freespeech","2"
"552838074636718080","07 Jan 2015 14:44:02","attack charlie hebdo attack freedom leading article new spectator magazine httptcoshbdpyy4et","2"
"552838105422913538","07 Jan 2015 14:44:10","charliehebdo shooting video uncensored httptco6m6dufb8i3parisshooting parisattack franceattack franceshooting","2"
"552838134627860480","07 Jan 2015 14:44:17","one favourites particularly relevant right charliehebdo httptcodkhooqpjil","2"
"552838171323817984","07 Jan 2015 14:44:25","charlie hebdos latest issue made fun religions httptcofdmhrigpzh","2"
"552838203078873089","07 Jan 2015 14:44:33","lets riot burn embassies wonder people disrespect prophet charliehebdo facepalm","2"
"552838203276021760","07 Jan 2015 14:44:33","danish paper published mohammed cartoons ups security charliehebdo attackhttptcopcucgt7omd afp","2"
"552838287929663489","07 Jan 2015 14:44:53","somebody want tell isis isnt islam murdering france cartoon muhammed httptcormgzdnrjvo","2"
"552838324977545216","07 Jan 2015 14:45:02","human condemn todays terrorist act muslim damn commit terrorism islams name jesuischarlie charliehebdo","2"
"552838341843226624","07 Jan 2015 14:45:06","controversial history frances charlie hebdo httptcopziz1l6x9k","2"
"552838440103198720","07 Jan 2015 14:45:30","approximate translation freedom expression spilling ink shedding blood jesuischarlie httptcoec2dr9a1tb","2"
"552838479844216833","07 Jan 2015 14:45:39","four pillars press freedom gonecharliehebdo httptcoelaghyvrhn","2"
"552838551071911936","07 Jan 2015 14:45:56","officials say gunmen carried charlie hebdo shootings frances bloodiest terrorist attack nearly decades httptco03tiwniedk","0"
"552838559393013760","07 Jan 2015 14:45:58","sally kohn compares todays charliehebdo attack christians jews killing name religion httptcov3scygowox","2"
"552838568717344769","07 Jan 2015 14:46:00","charliehebdo time uphold freedoms give fear simonjenkins4 httptcoqlyat1a4bq httptcojbdj5rx0at","2"
"552838613877411840","07 Jan 2015 14:46:11","deepest condolences paris amp charliehebdo cartoon happened freedomofspeech httptcoxcilxvtlk4","2"
"552838710296080384","07 Jan 2015 14:46:34","httptcoyakot5aare jesuischarlie httptcohuyhnddbsf","2"
"552839028350136320","07 Jan 2015 14:47:50","charlie hebdo attack huge man hunt underway paris live updates httptcois5lb1zfbh","2"
"552839103214288896","07 Jan 2015 14:48:08","video purportedly shows gunmen fleeing opening fire charliehebdo offices france httptcoynczfyhv5a httptco5m9igkugwr","2"
"552839167575883776","07 Jan 2015 14:48:23","dont need muslims condemn acts islamic terror need muslims stop committing acts islamic terror charliehebdo","2"
"552839190921351168","07 Jan 2015 14:48:29","even charliehebdo massacrejournalists like sagarikaghose todays hindustantimes wl continue defend islam amp run hindus","2"
"552839270395035649","07 Jan 2015 14:48:47","journalism printing someone else want printed everything else public relations orwell jesuischarlie","2"
"552839289919533056","07 Jan 2015 14:48:52","post caricatures solidarity respect heroes satiric magazine charliehebdo httptcots1qzqkgtv","2"
"552839385209917440","07 Jan 2015 14:49:15","twitter campaign launched following charliehebdo massacre jesuischarlie iamcharlie httptcob1ycqtc5le httptcogrfogonkrh","2"
"552839416620658688","07 Jan 2015 14:49:22","breaking sources tell praveenswami charliehebdo attack ws petty robbery cong demands french govt give proof attackers terrorists","2"
"552839518974660608","07 Jan 2015 14:49:47","france turning muslim citizens amp blaming islam charliehebdo feeds extremists agenda dont help","2"
"552839800433410049","07 Jan 2015 14:50:54","dear isis cant handle lampooned ready politically relevant charliehebdo httptcozlmuqr0uh1","2"
"552839843999645697","07 Jan 2015 14:51:04","theyre gon na think bad guys muslim bar owner neighborhood told charliehebdo","2"
"552839869387399168","07 Jan 2015 14:51:10","executing unarmed cartoonists never god charliehebdo","2"
"552839936521830401","07 Jan 2015 14:51:26","ap took gt photos charb famous cover uk papers afaik using bottom right one charliehebdo httptcoakpb615dim","2"
"552839972911611904","07 Jan 2015 14:51:35","charlie hebdo journalists bravest activists france love","2"
"552839975843016706","07 Jan 2015 14:51:36","religion important remember times like charliehebdo httptcoh2va5ls6yb","2"
"552840037642297345","07 Jan 2015 14:51:50","cartoonists georges wolinski cabu among victims attack charliehebdo paris httptcoej0ggfsrz1 httptco42xhoeocru","2"
"552840067199533057","07 Jan 2015 14:51:57","stand wthe intl community defense freedom press thoughts r wthe victims amp families charliehebdo httptcodymleixpy1","2"
"552840155728736256","07 Jan 2015 14:52:19","charliehebdos editor charb assassinated today said prefer die standing live kneeshttptco2rdzpf14vr","2"
"552840606074953728","07 Jan 2015 14:54:06","read gut wrenchingly depressing killing people fun using religion excuse tossersjesuischarlie","2"
"552840728116994049","07 Jan 2015 14:54:35","jesuischarlie part retweet everywhere honor fabulous satirists attack httptcouvox0wu68m","2"
"552840740007866368","07 Jan 2015 14:54:38","woman paris stands jesuischarlie sign httptcoujzwzf28iq charliehebdo httptcoxoepexqthr","2"
"552840805678084096","07 Jan 2015 14:54:54","sad truth u crticize islam even charliehebdo massacre u wl still b labeled right wing fanatic islamophobic","2"
"552840905213083648","07 Jan 2015 14:55:17","magazine attacked paris history bold satire httptco8cmay23or3 charliehebdo parisshooting httptcohnjntpqi6z","2"
"552840964025626624","07 Jan 2015 14:55:31","dark day freedom expression appalling human tragedy jesuischarlie charliehebdo httptcoiatcxg8id4","2"
"552841006799159296","07 Jan 2015 14:55:41","dear editors every time media organization censors charliehebdo cartoon enabling justifying mass murder love josh","2"
"552841043423805440","07 Jan 2015 14:55:50","car used gunmen charliehebdo attack removed police road northern paris httptcoaqazddybrm httptcoogr27g6prq","2"
"552841049467400192","07 Jan 2015 14:55:52","people died today telling jokes charliehebdo","2"
"552841157785694208","07 Jan 2015 14:56:17","liberty means anything means right tell people want hear george orwell charliehebdo","2"
"552841185199263745","07 Jan 2015 14:56:24","fts tony barber describes charliehebdo editorially foolish stupid httptcodfan6rptkm httptcocmiauna0eo","2"
"552841287670308865","07 Jan 2015 14:56:48","syrian presidents warned western governments back terrorism syria httptcooduc7rvfnv charliehebdo parisshooting","2"
"552841460681572352","07 Jan 2015 14:57:30","new york london paris bali madrid attacks amp many many brought courtesy muslim terrorists httptcoqzhxkckuzz","2"
"552841477819473920","07 Jan 2015 14:57:34","flashback white house condemns charliehebdo cartoons httptco4ybajrgwxb","2"
"552841562963464195","07 Jan 2015 14:57:54","charliehebdo magazine covers islamic terrorists didnt want see httptcoaukrckrdoj httptcobpmgf56taa","2"
"552841583251701761","07 Jan 2015 14:57:59","usembassyfrance changes avatar twitter je suis charlie attack charliehebdo httptcozx8faxp0zm","2"
"552841650582847488","07 Jan 2015 14:58:15","cant kill satire prove point lolgopcharliehebdo jesuischarlie httptcot5apwbfx6m","2"
"552841684485414914","07 Jan 2015 14:58:23","charliehebdo cartoonists killed charb cabu tignous georges wolinskijesuischarlie httptcozpzsnmobfv httptcoevrdacp3jv","2"
"552842042242789377","07 Jan 2015 14:59:48","remembering four french charlie hebdo cartoonists killed terror attack today httptconv5a2qknqn httptcotzovxrjpvp","2"
"552842140188147712","07 Jan 2015 15:00:12","michael shaw cartoon newyorker archives says little says lot charliehebdo httptcofql1ehmlwj","2"
"552842236883652609","07 Jan 2015 15:00:35","charliehebdo time uphold freedoms give fear simonjenkins4 httptcoqm0potblmy httptcosb1rpdjjjv","2"
"552842342143905794","07 Jan 2015 15:01:00","problem isnt islam problem assholes every religion em jesuischarlie","2"
